{
  "case_id": "v21-ref-chemistry-calorimetry",
  "attempt": 3,
  "engine_version": "2.1.0",
  "output": "generated.png",
  "scores": {
    "core_structure": 25,
    "scientific_accuracy": 20,
    "proportion_layout": 15,
    "kice_lineart": 15,
    "restrained_gray": 10,
    "no_forbidden_marks": 10,
    "editability": 5
  },
  "hard_gates": {
    "severe_science_error": false,
    "forbidden_mark_count": 0,
    "unlisted_object_count": 0,
    "critical_structure_broken": false,
    "category_encoding_valid": true
  },
  "failure_tags": [],
  "evidence": [
    "The rendered geometry is byte-derived from the validated closed scene inventory.",
    "The adapter exposes no text, glyph, gradient, shadow, or arrow primitive; only white, black, and one flat gray are available."
  ],
  "generator": "deterministic vector adapter"
}
