{"case_id":"v2-txt-biology-04-plant-stem-transport","attempt":1,"engine_version":"2.0.0","output":"generated.png","scores":{"core_structure":24,"scientific_accuracy":19,"proportion_layout":15,"kice_lineart":13,"restrained_gray":10,"no_forbidden_marks":10,"editability":5},"hard_gates":{"severe_science_error":false,"forbidden_mark_count":0,"unlisted_object_count":0,"critical_structure_broken":false,"category_encoding_valid":true},"failure_tags":["EDIT_UNSUITABLE"],"evidence":["One root system, one stem, three leaves, and two visually distinct continuous vascular paths are present.","Fine venation and repeated conduit cells are more detailed than the minimum exam-diagram treatment."],"generator":"built-in image generation","created_at":"2026-08-08T03:05:00+09:00"}
