{"case_id":"v2-sketch-physics-05-coil-compass","attempt":1,"engine_version":"2.0.0","output":"generated.png","scores":{"core_structure":16,"scientific_accuracy":10,"proportion_layout":13,"kice_lineart":13,"restrained_gray":10,"no_forbidden_marks":10,"editability":5},"hard_gates":{"severe_science_error":true,"forbidden_mark_count":0,"unlisted_object_count":0,"critical_structure_broken":true,"category_encoding_valid":true},"failure_tags":["TOPOLOGY_LOSS","CATEGORY_COLLAPSE"],"evidence":["The battery, compass, rod needle, and outer circuit are recognizable and contain no arrowhead.","The supposed coil is rendered as a row of disconnected U-shaped loops rather than one continuous coil with two terminals."],"generator":"built-in image generation","created_at":"2026-08-08T03:10:00+09:00"}
