{"case_id":"v2-sketch-earth-05-river-valley-section","attempt":1,"engine_version":"2.0.0","output":"generated.png","scores":{"core_structure":25,"scientific_accuracy":20,"proportion_layout":15,"kice_lineart":15,"restrained_gray":10,"no_forbidden_marks":10,"editability":5},"hard_gates":{"severe_science_error":false,"forbidden_mark_count":0,"unlisted_object_count":0,"critical_structure_broken":false,"category_encoding_valid":true},"failure_tags":[],"evidence":["The river occupies the lowest channel and exactly six rounded clasts lie only along its bed.","Three sparse layer boundaries and a single gray water region preserve the sketch layout without decorative texture."],"generator":"built-in image generation","created_at":"2026-08-08T03:10:00+09:00"}
