{"case_id":"v2-txt-physics-01-series-circuit-switch","attempt":1,"engine_version":"2.0.0","output":"generated.png","scores":{"core_structure":25,"scientific_accuracy":20,"proportion_layout":15,"kice_lineart":14,"restrained_gray":10,"no_forbidden_marks":10,"editability":5},"hard_gates":{"severe_science_error":false,"forbidden_mark_count":0,"unlisted_object_count":0,"critical_structure_broken":false,"category_encoding_valid":true},"failure_tags":[],"evidence":["A single series path contains one open-switch gap; conductors terminate independently at distinct battery plates with no battery bypass or crossing.","The diagram is unshaded black line art with no text, symbols, labels, or arrows."],"generator":"built-in image generation","created_at":"2026-08-08T01:54:00+09:00"}
