{"case_id":"v2-sketch-earth-04-eclipse-alignment","attempt":1,"engine_version":"2.0.0","output":"generated.png","scores":{"core_structure":25,"scientific_accuracy":20,"proportion_layout":15,"kice_lineart":14,"restrained_gray":10,"no_forbidden_marks":10,"editability":5},"hard_gates":{"severe_science_error":false,"forbidden_mark_count":0,"unlisted_object_count":1,"critical_structure_broken":false,"category_encoding_valid":true},"failure_tags":["EXTRA_CONTEXT"],"evidence":["Sun, earth, and moon disks are ordered left to right with horizontally aligned centers and no rays or arrows.","A large enclosing rectangular frame not present in the closed inventory was added around the composition."],"generator":"built-in image generation","created_at":"2026-08-08T03:10:00+09:00"}
