{"case_id":"v2-sketch-chemistry-04-particle-two-states","attempt":1,"engine_version":"2.0.0","output":"generated.png","scores":{"core_structure":25,"scientific_accuracy":20,"proportion_layout":15,"kice_lineart":12,"restrained_gray":10,"no_forbidden_marks":10,"editability":5},"hard_gates":{"severe_science_error":false,"forbidden_mark_count":0,"unlisted_object_count":0,"critical_structure_broken":false,"category_encoding_valid":true},"failure_tags":["EDIT_UNSUITABLE"],"evidence":["Each of two equal containers contains exactly six round and four angular particles with conserved species counts.","Sketch edge doublets remain as redundant inner outlines on containers and particles, reducing line-art economy."],"generator":"built-in image generation","created_at":"2026-08-08T03:10:00+09:00"}
