{"case_id":"v2-txt-physics-04-spring-two-states","attempt":1,"engine_version":"2.0.0","output":"generated.png","scores":{"core_structure":18,"scientific_accuracy":13,"proportion_layout":14,"kice_lineart":14,"restrained_gray":10,"no_forbidden_marks":10,"editability":5},"hard_gates":{"severe_science_error":false,"forbidden_mark_count":0,"unlisted_object_count":0,"critical_structure_broken":true,"category_encoding_valid":true},"failure_tags":["STRUCTURE_LOSS"],"evidence":["Two supports, springs, and equal masses are arranged in comparable states.","The extended spring has roughly twice the visible coil count, violating the frozen equal-coil invariant instead of changing spacing alone."],"generator":"built-in image generation","created_at":"2026-08-08T02:46:00+09:00"}
