{"case_id":"v2-ref-chemistry-04-particle-two-states","attempt":1,"engine_version":"2.0.0","output":"generated.png","scores":{"core_structure":25,"scientific_accuracy":20,"proportion_layout":15,"kice_lineart":15,"restrained_gray":10,"no_forbidden_marks":10,"editability":5},"hard_gates":{"severe_science_error":false,"forbidden_mark_count":0,"unlisted_object_count":0,"critical_structure_broken":false,"category_encoding_valid":true},"failure_tags":[],"evidence":["Each equal container holds exactly six circles and four diamonds, with no particle crossing a panel boundary.","Counts and shape-based species encoding remain constant and require no gray, text, or symbols."],"generator":"built-in image generation","created_at":"2026-08-08T02:38:00+09:00"}
