{"case_id":"v2-sketch-biology-03-lungs-two-states","attempt":3,"engine_version":"2.0.0","output":"generated.png","scores":{"core_structure":22,"scientific_accuracy":19,"proportion_layout":14,"kice_lineart":11,"restrained_gray":7,"no_forbidden_marks":10,"editability":4},"hard_gates":{"severe_science_error":false,"forbidden_mark_count":0,"unlisted_object_count":2,"critical_structure_broken":false,"category_encoding_valid":true},"failure_tags":["EXTRA_CONTEXT","OVER_SHADE","MODEL_VARIANCE"],"evidence":["Panel frames now use one stroke, but each zero-thickness diaphragm curve is still rendered as a two-line band, doubling the required curve count.","The three-attempt development case remains failed and is retained as a known model-variance boundary rather than being reclassified."],"generator":"built-in image generation","created_at":"2026-08-08T02:31:00+09:00"}
