{"case_id":"v2-sketch-physics-04-spring-two-states","attempt":1,"engine_version":"2.0.0","output":"generated.png","scores":{"core_structure":18,"scientific_accuracy":12,"proportion_layout":14,"kice_lineart":14,"restrained_gray":10,"no_forbidden_marks":10,"editability":5},"hard_gates":{"severe_science_error":false,"forbidden_mark_count":0,"unlisted_object_count":0,"critical_structure_broken":true,"category_encoding_valid":true},"failure_tags":["STRUCTURE_LOSS","SCIENCE_ERROR"],"evidence":["Two equal panels contain matched supports, springs, and masses with the intended height difference.","The right spring has more zigzag coils than the left, violating the equal coil-count invariant."],"generator":"built-in image generation","created_at":"2026-08-08T03:10:00+09:00"}
