{"case_id":"v2-txt-biology-03-lungs-two-states","attempt":1,"engine_version":"2.0.0","output":"generated.png","scores":{"core_structure":25,"scientific_accuracy":20,"proportion_layout":13,"kice_lineart":13,"restrained_gray":7,"no_forbidden_marks":10,"editability":5},"hard_gates":{"severe_science_error":false,"forbidden_mark_count":0,"unlisted_object_count":0,"critical_structure_broken":false,"category_encoding_valid":true},"failure_tags":["OVER_SHADE"],"evidence":["Two same-view torso panels each contain a tracheal branch, paired lungs, and one diaphragm; the larger lungs pair with the lower, flatter diaphragm.","Minor torso/trachea geometry drift and graded lung fill reduce repeat-state and gray scores but preserve the declared state comparison."],"generator":"built-in image generation","created_at":"2026-08-08T02:05:00+09:00"}
