{"case_id":"v2-txt-earth-04-eclipse-alignment","attempt":1,"engine_version":"2.0.0","output":"generated.png","scores":{"core_structure":25,"scientific_accuracy":20,"proportion_layout":15,"kice_lineart":14,"restrained_gray":7,"no_forbidden_marks":10,"editability":5},"hard_gates":{"severe_science_error":false,"forbidden_mark_count":0,"unlisted_object_count":0,"critical_structure_broken":false,"category_encoding_valid":true},"failure_tags":["OVER_SHADE"],"evidence":["Sun, earth, and moon occur once in the required left-to-right order with horizontally aligned centers.","The allowed earth half is gray, but it uses a gradient instead of one uniform tone."],"generator":"built-in image generation","created_at":"2026-08-08T03:05:00+09:00"}
