{"case_id":"v2-ref-earth-03-faulted-strata","attempt":1,"engine_version":"2.0.0","output":"generated.png","scores":{"core_structure":25,"scientific_accuracy":20,"proportion_layout":15,"kice_lineart":14,"restrained_gray":7,"no_forbidden_marks":10,"editability":5},"hard_gates":{"severe_science_error":false,"forbidden_mark_count":0,"unlisted_object_count":0,"critical_structure_broken":false,"category_encoding_valid":true},"failure_tags":["OVER_SHADE"],"evidence":["All four strata preserve order and share the same downward offset across one inclined fault plane.","Only the second stratum is gray, though the fill is softly graded instead of uniform."],"generator":"built-in image generation","created_at":"2026-08-08T01:51:00+09:00"}
