{"case_id":"v2-ref-biology-01-heart-four-chambers","attempt":1,"engine_version":"2.0.0","output":"generated.png","scores":{"core_structure":25,"scientific_accuracy":19,"proportion_layout":14,"kice_lineart":14,"restrained_gray":9,"no_forbidden_marks":10,"editability":5},"hard_gates":{"severe_science_error":false,"forbidden_mark_count":0,"unlisted_object_count":0,"critical_structure_broken":false,"category_encoding_valid":true},"failure_tags":[],"evidence":["Four separate chambers, a ventricular septum, and four vessel stubs terminating at the heart boundary are present.","The simplified wall gray is restrained and the diagram leaves clear room for later labels without generating any marks."],"generator":"built-in image generation","created_at":"2026-08-08T01:43:00+09:00"}
