{
  "case_id": "example-series-circuit",
  "attempt": 1,
  "engine_version": "2.0.0",
  "output": "generated.png",
  "scores": {
    "core_structure": 17,
    "scientific_accuracy": 8,
    "proportion_layout": 13,
    "kice_lineart": 14,
    "restrained_gray": 10,
    "no_forbidden_marks": 10,
    "editability": 5
  },
  "hard_gates": {
    "severe_science_error": true,
    "forbidden_mark_count": 0,
    "unlisted_object_count": 0,
    "critical_structure_broken": true,
    "category_encoding_valid": true
  },
  "failure_tags": ["SCIENCE_ERROR", "TOPOLOGY_LOSS"],
  "evidence": ["The left vertical conductor bypasses the two battery plates, so the battery is not inserted into the circuit.", "The switch is open and no text or arrows are present."],
  "generator": "built-in image generation",
  "created_at": "2026-08-08T01:00:00+09:00"
}
