{
  "case_id": "example-series-circuit",
  "attempt": 2,
  "engine_version": "2.0.0",
  "output": "generated.png",
  "scores": {
    "core_structure": 25,
    "scientific_accuracy": 20,
    "proportion_layout": 14,
    "kice_lineart": 14,
    "restrained_gray": 10,
    "no_forbidden_marks": 10,
    "editability": 5
  },
  "hard_gates": {
    "severe_science_error": false,
    "forbidden_mark_count": 0,
    "unlisted_object_count": 0,
    "critical_structure_broken": false,
    "category_encoding_valid": true
  },
  "failure_tags": [],
  "evidence": ["The upper and lower conductors terminate at different battery plates with no bypass.", "The switch gap is the only open point and the lamp is in series.", "No text, digits, labels, leader lines, symbols, or arrows are visible."],
  "generator": "built-in image generation",
  "created_at": "2026-08-08T01:10:00+09:00"
}
