{"case_id":"v2-sketch-chemistry-03-gas-over-water","attempt":1,"engine_version":"2.0.0","output":"generated.png","scores":{"core_structure":25,"scientific_accuracy":20,"proportion_layout":15,"kice_lineart":14,"restrained_gray":7,"no_forbidden_marks":10,"editability":5},"hard_gates":{"severe_science_error":false,"forbidden_mark_count":0,"unlisted_object_count":0,"critical_structure_broken":false,"category_encoding_valid":true},"failure_tags":["OVER_SHADE"],"evidence":["The sketch's flask-to-trough composition is preserved while the tube terminates under water inside the open-bottom inverted gas jar.","Gas remains above the jar water level; gray is confined to water but remains mildly graded."],"generator":"built-in image generation","created_at":"2026-08-08T02:17:00+09:00"}
