{"case_id":"v2-txt-chemistry-01-simple-distillation","attempt":2,"engine_version":"2.0.0","output":"generated.png","scores":{"core_structure":25,"scientific_accuracy":20,"proportion_layout":14,"kice_lineart":14,"restrained_gray":7,"no_forbidden_marks":10,"editability":5},"hard_gates":{"severe_science_error":false,"forbidden_mark_count":0,"unlisted_object_count":0,"critical_structure_broken":false,"category_encoding_valid":true},"failure_tags":["OVER_SHADE"],"evidence":["Flask, stopper, plain unmarked thermometer, delivery tube, open receiver, and heater have the required topology.","The chemistry guardrail removed the thermometer pointer; only mild liquid gradients remain as a style penalty."],"generator":"built-in image generation","created_at":"2026-08-08T02:02:00+09:00"}
